submission_id,title,text,num_votes,num_comments,date,author,author_id,author_name
1akynbd,L'UE recule sur la réduction des pesticides : cadeau aux agriculteurs ou à l'agrochimie ?,,69,25,"07/02/2024, 08:52:31",t2_t16fr,t16fr,Folivao
1aleoht,"Si vous deviez noter l'utilité réel de votre travail que une échelle de 0 à 10, quel note donneriez vous ?","0 étant le bulshit job ultime, genre ""consultant en gestion d'activité de cohésion en entreprise""


10 étant les médecins, ouvrier du bâtiment,  agriculteurs, professeur... bref les trucs essentiels sans qui tout s'effondre.

Bref quel serait la note et pourquoi ?",223,650,"07/02/2024, 21:48:23",t2_dfxglyvc0,dfxglyvc0,ad-undeterminam
1agx03j,Gabriel Attal tente d’éteindre la colère des agriculteurs en cédant sur l’environnement,,266,150,"02/02/2024, 06:12:57",t2_2i152lwx,2i152lwx,Proudhmak87
1agk0hy,Prague veut une réponse forte face aux agriculteurs français ayant attaqué des camions tchèques,,162,25,"01/02/2024, 19:58:30",t2_5bnih6r,5bnih6r,DicentricChromosome
1ael0kl,Pourquoi les agriculteurs n'achètent pas français?,"Une des revendications de la manif des agri est d'inciter à la consommation de produits francais.

En regardant les convois de tracteurs des manifs (je passe sur le côté complètement indécent d'avoir des tracteurs neufs à 150 000€ complètement démesurés par rapport  à leur besoins quand en même ils se plaignent de leur revenus trop bas), je remarque une majorité de tracteurs de 100 -150 000€ fabriqué à l'étranger (John Deere , Fendt et j'en passe...), alors que nous avons de grosses usines Massey Ferguson et Claas en France. Quel est leur argument pour acheter étranger (sur des montants colossaux) vs un français qui achète quelques kg de fruits importés?",101,403,"30/01/2024, 10:04:38",t2_3ooog9vx,3ooog9vx,papuniu
1afj6nt,Ou sont donc les sondages sur les soutients au mouvement des agriculteurs ?,"Durant les contestations des dernières années sous l'air Macron, les médias nous parlaient tous les jours de sondage sur le soutien de la population sur tel ou tel mouvement (gilet jaunes, personnels medicals, loi travail, réforme des retraites etc) et tous les jours nous avions droit a un baromètre que soit le gouvernement soit les oppositions mettaient en avant pour appuyer leurs arguments.

J'ecoute France info tous les matins en allant travailler, je regarde le 19h30 Media de Quotidien qui donne un aperçu de ce qu'ont parlé les médias durant la journée et j'ai noté que depuis le début de ce mouvement, aucun sondage n'est mis en avant , aucun baromètre de soutien ou non, juste quelque micro trottoir par ci par là dans les JT.

Est ce moi où est-ce un sujet à ne pas sonder?",37,52,"31/01/2024, 14:33:11",t2_8xcoo2w,8xcoo2w,ShengAman
1ag5ddi,Les Parisiens n’ont « pas peur des agriculteurs » du blocus de Rungis,,7,33,"01/02/2024, 07:24:18",t2_ngdupuix9,ngdupuix9,MarkWhalbergsSon
1agbivs,"Colère des agriculteurs : le gouvernement va ""mettre en pause"" le plan Ecophyto qui vise à réduire l'usage des pesticides",,233,140,"01/02/2024, 13:55:14",t2_ngdupuix9,ngdupuix9,MarkWhalbergsSon
1afdalr,"DIRECT. Agriculteurs en colère: Darmanin ne les ""laissera pas faire"" s'ils bloquent le marché de Rungis",,124,100,"31/01/2024, 08:35:39",t2_49m7r7qh,49m7r7qh,johnnys7788
1aci6et,"DIRECT. Colère des agriculteurs : les syndicats FNSEA et Jeunes agriculteurs annoncent un ""siège"" de Paris à partir de lundi",,182,128,"27/01/2024, 19:02:17",t2_t16fr,t16fr,Folivao
1aemjzy,"Badminton, vélo... À Grenoble, une autoroute bloquée par les agriculteurs transformée en aire piétonne",Comment s'approprier un espace public... J'adore!!,208,18,"30/01/2024, 11:46:00",t2_8xwbc1s9,8xwbc1s9,djangogarib
1afgr3v,Colère des agriculteurs : 15 personnes placées en garde à vue pour entrave à la circulation près de Rungis,,22,3,"31/01/2024, 12:29:54",t2_ngdupuix9,ngdupuix9,MarkWhalbergsSon
1ae6qe9,Colère des agriculteurs : des attentes pour les retraites,,4,2,"29/01/2024, 21:27:41",t2_ngdupuix9,ngdupuix9,MarkWhalbergsSon
1aenq5k,"Trolls russes, complotistes, extrême droite : le hashtag #AgriculteursEnColere envahi par les récupérations",,61,14,"30/01/2024, 12:53:24",t2_da4ec,da4ec,asimovwasright
1afrkt9,"Qu’est-ce que l’Office français de la Biodiversité, cette « police » visée par la colère des agriculteurs ?",,61,33,"31/01/2024, 20:21:04",t2_wlru5,wlru5,Thor1noak
1adwx2e,Colère des agriculteurs : pourquoi les mobilisations se poursuivent,,13,4,"29/01/2024, 14:43:25",t2_5uqbru5g,5uqbru5g,ryt1820
1ac5vwx,"Colère des agriculteurs : la FNSEA, les Jeunes Agriculteurs et la Confédération paysanne appellent à poursuivre la mobilisation",,69,39,"27/01/2024, 08:03:14",t2_mwvuoifr5,mwvuoifr5,cl1235711
1abp1xb,"Agriculteurs en colère : du poulet brésilien, congelé en 2022, intercepté par les Jeunes agriculteurs à Marmande",,107,64,"26/01/2024, 18:20:42",t2_374uf9,374uf9,collax974
1afgb5c,"VIDEO. Colère des agriculteurs : une tête de sanglier, des tonnes de fumier... les chasseurs de l'Hérault pris pour cible",,133,50,"31/01/2024, 12:03:57",t2_1rklznqm,1rklznqm,CapriiiCestFiniiiii
1aejjga,Jordan Bardella profite de la colère des agriculteurs pour lancer une offensive contre l’« écologie punitive »,,84,74,"30/01/2024, 08:19:25",t2_t16fr,t16fr,Folivao
